<!ELEMENT properties (property*)>
<!ELEMENT property (string|list|map)>
<!ELEMENT string (#PCDATA)>
<!ELEMENT list (string*)>
<!ELEMENT map (entry*)>
<!ELEMENT entry (#PCDATA)>

<!ATTLIST property
	key CDATA #REQUIRED
>
<!ATTLIST entry
	key CDATA #REQUIRED
>